articlename;textdata
http://regional./read/2016/10/20/12504331/gamawan.sebut.anggaran.ktp.elektronik.dibahas.bersama.wapres.dan.sri.mulyani;"Gamawan Sebut Anggaran KTP Elektronik Dibahas bersama Wapres dan Sri MulyaniJAKARTA,   Mantan Menteri Dalam Negeri, Gamawan Fauzi, menyebutkan, anggaran pengadaan paket penerapan kartu tanda penduduk (KTP) berbasis nomor induk kependudukan secara nasional atau disebut KTP elektronik dibahas bersama Wakil Presiden dan menteri-menteri terkait. ""Anggaran itu kan dibahas"
https://biz./read/2016/02/28/090910928/Pemkot.Tangerang.Permudah.Investasi.Dengan.Perizinan.Online.dan.Aplikasi.Siap.Kerja;"Pemkot Tangerang Permudah Investasi Dengan Perizinan Online dan Aplikasi Siap Kerja Kota Tangerang kini menginjak usia 23 tahun. Banyak perubahan serta kemajuan signifikan yang telah dirasakan warga kota dengan bandar udara terbesar di Indonesia  ini sejak berpisah dari Kabupaten Tangerang. Salah satu perubahan yang mudah dirasakan masyarakat berada di bidang pelayanan. Selama dua tahun terakhir, Pemerintah Kota Tangerang di bawah kepemimpinan Arief R Wismansyah–Sachrudin meneguhkan komitmen untuk memberikan pelayanan terbaik kepada masyarakat. Walikota Tangerang Arief R Wismansyah mengungkapkan Pemerintah Kota Tangerang terus berusaha meningkatkan pelayanan kepada masyarakat sesuai dengan program LIVE yang dicanangkannya. LIVE merupakan singkatan dari Liveable, Investable, Visitable dan E-City. Melalui Dinas Informasi dan Komunikasi, konsep E-city atau kota berbasis internet terus diwujudkan. “Saya mendorong penerapan aplikasi-aplikasi online yang dapat memudahkan masyarakat mendapatkan pelayanan publik. Salah satu yang kami dorong penerapannya adalah pelayanan online bagi masyarakat yang ingin berinvestasi. Pemkot Tangerang ingin memberi kemudahan kepada para calon investor dalam proses perijinan sehingga iklim investasi di kota ini terus bertambah baik,”ujar Walikota Tangerang Arief R Wismansyah. Menurut Walikota, Presiden RI memberikan instruksi agar pemerintah daerah untuk memberikan kemudahan perizinan terhadap dunia investasi. Pemerintah pusat meminta daerah dapat menyelesaikan pengurusan izin paling lambat 3 hari. Namun Pemkot Tangerang bertekad melakukannya lebih cepat. “Jangankan 3 hari, 3 jam juga bisa kita selesaikan, asalkan seluruh berkas perizinannya sudah lengkap, gak ada yang dipersulit,"" tegas Walikota. Kepala Dinas Komunikasi dan Informatika Kota Tangerang, Muhtarom mengungkapkan ada dua jenis aplikasi online yang dikembangkan berdasarkan tujuan pembangunannya. Jenis pertama adalah aplikasi yang dibangun untuk memudahkan masyarakat dalam mendapatkan layanan pemerintah daerah (E-Publik). Contohnya adalah sistem arsip digital perpustakaan, penerimaan siswa baru online, kartu kuning online, pelaporan pajak daerah online, sistem informasi RSUD Kota Tangerang, aplikasi perijinan online untuk Surat Ijin Usaha Perdagangan dan Tanda Daftar Perusahaan (TDP) dan aplikasi Tangerang Siap Kerja. Untuk diketahui, pelayanan perizinan online terintegrasi dengan Sistem Informasi Administrasi Kependudukan (SIAK), sehingga perizinan online itu juga sekaligus sebagai wujud implementasi tertib administrasi kependudukan. ""Jadi daftarnya cukup dengan NIK, siapapun bisa langsung mengajukan izin online,"" jelasnya. Sebelumnya,  jenis kedua yakni aplikasi yang dibangun dalam rangka mempercepat dan mempermudah proses didalam penyelenggaraan pemerintahan guna memberikan pelayanan yang  maksimal kepada masyarakat (E-Goverment). Beberapa diantara aplikasi online yang bermanfaat bagi efektifitas birokrasi itu yakni sistem informasi barang daerah, sistem informasi keuangan daerah, sistem informasi dan pelaporan pembangunan, sistem informasi akuntansi, layanan pengadaan secara elektronik (LPSE) dan sistem informasi administrasi kependudukan. Secara keseluruhan hingga akhir Februai 2016 ini terdapat sebanyak 130 aplikasi online yang sudah dibangun dan dikembangkan Dinas Komunikasi dan Informatika Kota Tangerang. Kepala Seksi Pengembangan E-Government Dinas Kominfo Kota Tangerang Adhi Zulkifli mengungkapkan melalui aplikasi perijinan online, pemohon mendapatkan kemudahan. Pemohon bisa lebih cepat dalam mengurus perijinan karena hanya perlu dua kali datang ke kantor Badan Penanaman Modal dan Perijinan Terpadu Satu Pintu (BPMPTSP) Kota Tangerang. Seorang pemohon ijin, kata Adhi, mengisi pendaftaran ijin secara online kemudian mendatangi kantor BPMPTSP untuk menyerahkan berkas. Pemohon memang masih harus hadir di kantor BPMPTSP karena berdasarkan undang-undang, perijinan dikeluarkan dengan tanda tangan basah atau langsung. “Melalui ijin online, pemohon bisa mengetahui persyaratan yang dibutuhkan sehingga dapat melengkapinya saat penyerahan berkas. Ada efisiensi waktu karena pemohon ijin online hanya perlu datang sebanyak dua kali. Jika menggunakan jalur manual, pemohon bisa tiga empat kali datang untuk mengurus berkas,”ujar Adhi. Kepala BPMPTSP Kota Tangerang Karsidi mengungkapkan sepanjang tahun 2015 lalu, investasi didominasi sektor industri logam dasar, barang logam, mesin dan elektronik, Industri kertas, barang dari kertas dan percetakan. Di tahun ini, BPMPTSP Kota Tangerang akan melakukan sejumlah terbobosan. Di antaranya menyiapkan pelayanan mobil perizinan keliling, pendelegasian kewenangan tanda tangan perizinan, dan juga revisi penghitungan IMB. Karsidi juga mendukung perizinan online yang sedang dikembangkan.Walikota Tangerang Arief R Wismansyah saat launching perizinan online Aplikasi Siap Kerja Membantu Perusahaan Tak hanya memperingkat proses perijinan, Pemerintah Kota Tangerang juga berusaha memudahkan para investor yang tertarik menanamkan modal sekaligus membangun perusahaan di Kota Tangerang. Melalui program Siap Kerja, Pemerintah Kota Tangerang memberikan kemudahan kepada perusahaan ketika hendak memenuhi kebutuhan tenaga kerjanya. Aplikasi Siap Kerja merupakan penyempurnaan dari program Tangerang Siap Kerja yang berjalan sejak tahun 2013 lalu. Aplikasi ini berisikan data mengenai tenaga kerja yang tersedia di Kota Tangerang. Data yang tersedia terjamin akurasinya. Proses input data pencari kerja berlangsung di Dinas Tenaga Kerja Kota Tangerang. Setiap pencari kerja yang membuat kartu kuning di Disnaker diminta untuk melakukan input data secara langsung. Apabila pencari kerja merupakan warga Kota Tangerang maka yang bersangkutan hanya perlu memasukkan nomor induk kependudukannya. Pencari kerja selanjutnya mengisi data terkait tingkat pendidikan, kemampuan yang dimiliki dan beberapa informasi terkait lainnya. “Apa yang dilakukan Pemerintah Kota Tangerang terhadap para pencari kerja sudah dilakukan di Surabaya. Pencari kerja yang mengisi data harus bertanggungjawab atas informasi yang disampaikannya,”ungkap Adi Zulkifli, Kepala Seksi Pengembangan E-Government Dinas Komunikasi dan Informatika  Kota Tangerang. Hingga Februari 2016, jumlah pencari kerja yang tersedia di aplikasi Siap Kerja mencapai 34.179 orang. Sementara jumlah lowongan kerjanya mencapai 30.351. “Melalui aplikasi ini, perusahaan dapat mencari dan menemukan tenaga kerja sesuai kebutuhannya. Sementara manfaatnya bagi warga Kota Tangerang adalah bisa terakses oleh perusahaan,”imbuh Adhi. (Adv) "
https://biz./read/2016/03/28/142218228/Wajah.Baru.Pengadaan.Barang.Jasa.Simpel.tapi.Akuntabel;Wajah Baru Pengadaan Barang/Jasa, Simpel tapi Akuntabel Upaya pemerintah dalam melaksanakan pembangunan, tidak bisa dipisahkan dari peran strategis pengadaan. Tidak akan ada irigasi yang diperbaiki, ruang kelas sekolah yang ditambah, atau pun alat kesehatan puskesmas yang diremajakan, tanpa proses pengadaan.   Oleh sebab itu, sudah seharusnya sistem pengadaan nasional dikuatkan. Kebijakan penguatan sistem pengadaan nasional adalah dengan cara menyinergikan antara fleksibilitas dan akuntabilitas belanja pemerintah melalui pengadaan.  Fleksibilitas ini penting untuk  mengakomodasi kecepatan dan terobosan yang dibutuhkan dalam pengadaan barang/jasa, tetapi tanpa meninggalkan prinsip tranparansi dan akuntabilitas proses pengadaannya.    Tantangan untuk melaksanakan pengadaan yang fleksibel tetapi tetap akuntabel terjawab dengan inovasi pengadaan publik memanfaatkan Teknologi Informasi (TI).  Salah satu yang bisa kita lihat adalah penggunaan belanja pemerintah online (e-purchasing) melalui e-katalog yang dikelola oleh Lembaga Kebijakan Pengadaan Barang/Jasa Pemerintah (LKPP).    Sudah lebih dari 40.000 barang/jasa yang ada di situ, mulai dari toner hingga mobil damkar, yang proses pengadaannya tinggal klik dengan jaminan kepastian mutu, harga, dan penyedia.  Namun demikian, kebutuhan barang/jasa publik tidak bisa dipenuhi seluruhnya melalui e-katalog.  Secara teori, jenis barang/jasa yang paling cocok untuk pengadaan ini adalah yang high-volume low-value.  Sebaliknya, yang low-volume high-value masih tepat dieksekusi menggunakan lelang elektronik (e-tendering).   Berdasarkan hukum Pareto, jumlah paket pengadaan yang high-volume low-value ini kurang lebih mencapai angka 80 persen, tapi hanya menghabiskan anggaran 20 persen.  Sementara, paket yang ditenderkan memang hanya 20 persen, tetapi akan menghabiskan anggaran 80 persen.  Meskipun konsep ini bisa berubah, SmartReport LKPP mencatat proporsi anggaran pengadaan 2015 memang masih didominasi e-Tendering sebesar 85 persendan e-Purchasing 15 persen.  Oleh karena itu, perlu dilakukan terobosan untuk melaksanakan proses e-tendering yang lebih simpel.  Salah satu langkah yang mulai diperkenalkan LKPP adalah pemanfaatan SIKaP (Sistem Informasi Kinerja Penyedia), yaitu aplikasi yang memuat data kualifikasi dan kinerja penyedia barang/jasa.  - Pengadaan logistik Pilkada Serentak 2015 oleh KPU, adalah bukti lelang yang lebih sederhana dan selesai 3 hari saja karena menggunakan metode baru e-Lelang Cepat yang memanfaatkan SIKaP.  Dengan SIKaP, bagian tersulit dari proses pemilihan penyedia bisa terpangkas banyak.  Proses pemilihan penyedia barang/jasa pemerintah perlu diakui merupakan proses yang kompleks. Ketidaktepatan memilih penyedia inilah yang diyakini akan menghasilkan pengadaan yang tidak tepat mutu, tidak tepat waktu, atau tidak tepat harga.  Kondisi ini yang melatarbelakangi proses kompetisi penyedia jadi rumit untuk memfilter penyedia terbaik. Sayangnya, seringkali penyedia terbaiknya lebih fokus pada pemenuhan prosedur administrasi atau persyaratan teknis, bukan pada kinerja yang sesungguhnya. Keribetan ini menjadikan attractiveness pengadaan pemerintah menjadi rendah.  Akibatnya, partisipasi penyedia dalam proses pengadaan menjadi kecil. Ujung-ujungnya prosesnya menjadi tidak terlalu kompetitif, atau rentang kompetisinya menjadi kurang begitu lebar. Para penyedia potensial di pasar, malas ikut berkiprah dalam pengadaan barang/jasa pemerintah.  Dalam transaksi sehari-hari, kita sudah sering mendengar ungkapan yang sangat masuk akal “people do business with people they trust”.  SIKaP merupakan salah satu instrumen yang mampu memberi informasi kepada para pihak untuk memercayai penyedia tertentu.  Mari kita lihat ebay.com, e-marketplace dengan lebih dari 240 juta pelaku pasar dunia, yang menjual 80 juta produk setiap saatnya mulai dari daun sirsak hingga pesawat jet pribadi.  Mengapa buyer begitu saja rela melakukan pembelian terhadap seller yang tidak dikenalnya? Karena sistem transaksinya cukup memberikan jaminan kepercayaan pada pembeli, antara lain dengan memanfaatkan feedback setiap transaksi.  Pembeli diminta meninggalkan umpan balik yang positif, netral, atau negatif terhadap perilaku penjual berkaitan dengan akurasi spesifikasi yang dideskripsikan, kepuasan komunikasi, kecepatan pengiriman, maupun kewajaran harga yang disampaikan.  Rating terhadap penjual ini terbuka dan bisa diakses publik.  Selanjutnya ebay akan memberikan atribut  “PowerSeller”, untuk penjual yang memenuhi persyaratan tertentu, misalnya mendapat 98 persen feedback positif dari 100 kali transaksi senilai minimal US$3000.  Kita sebagai pembeli baru, tentu tidak akan pernah ragu bertransaksi dengan seorang PowerSeller, karena hampir bisa dipastikan yang bersangkutan enggan menggadai reputasinya hanya karena terlambat mengirim barang yang kita pesan misalnya.  Metode yang baik ini memang sudah seharusnya diadopsi dalam pengadaan publik. Timing yang tepat adalah sekarang juga, saat kita semua larut dalam era teknologi informasi dan kolaborasi. Teknologi Informasi mampu mencatat kinerja dengan lebih akurat. Subjektivitas penilaian kinerja akan dilawan dengan transparansi dan partisipasi publik. Pemanfaatan teknologi ini membuka peluang crowdsourcing, di mana penilaian kinerja dilakukan secara kolektif.   Dunia memang sudah dipesonakan oleh fakta bahwa tidak ada satu sumber daya pun yang mampu melawan sumber daya kerumunan ini. Don Tapscott dalam wikinomics mengatakan, vandalisme atau konten negatif dalam Wikipedia akan lenyap rata-rata kurang dari 1,7 menit karena dijaga dan dikoreksi secara kolektif oleh crowd.   Konsep crowdsourcing ini harus digunakan juga oleh SIKaP yang dalam implementasi awalnya akan mengkolaborasi seluruh entitas pengadaan di internal pemerintah.  Semua pelaku pengadaan dapat berkontribusi menggambarkan kinerja penyedia dalam SIKaP sehingga penyedia yang memang berkinerja harus diangkat reputasinya.  Melalui fasilitas OpenAPI, SIKaP dapat dikembangkan dengan fitur kolaborasi dan fitur sosial yang lebih luas. Dengan arsitektur terbuka, SIKaP ini diharapkan akan menjadi aplikasi andalan pengadaan ke depan, bukan hanya dimanfaatkan untuk e-Lelang Cepat seperti saat ini, tetapi semua metode pemilihan.  Babak adopsi Teknologi Informasi dalam pengadaan memang tidak bisa dihindari.  Sebut saja tiga keyword trend pengadaan masa depan menurut ProcureItRight: transparansi, otomasi, konektivitas.  ProcurementLeaders mengatakan perubahan pengadaan akan di-drive oleh teknologi big data, cloud, dan mobile.  Situasi ini semakin menguatkan SIKaP.  Trend ini akan mengubah bisnis proses pengadaan dari yang biasanya reaktif menjadi proaktif. Ditandai dengan pengadaan yang biasanya dipandang administratif menjadi strategis.  Dari yang menerima spesifikasi, menjadi berkontribusi memberi spesifikasi.  Dari yang sekedar menseleksi penyedia, manjadi membangun penyedia.  Pada gilirannya, ini akan membuat pengadaan publik berubah orientasi, dari prosedur menjadi kinerja.  Proses pemilihan yang sederhana, mampu meningkatkan daya tarik pengadaan publik menjadi lebih baik, yang seharusnya berakibat pula pada pelayanan publik yang membaik.  SIKaP yang diluncurkan di sikap.lkpp.go.id inilah yang akan menjawab tantangan ke depan, mengubah wajah pengadaan publik menjadi lebih fleksibel tapi akuntabel, simpel tapi tetap kredibel.  Mari kawal implementasinya. (Adv)  
https://biz./read/2016/03/29/160443028/Pengusaha.Kecil.dan.Menengah.Bisa.Ikut.Jadi.Penyedia.Barang.Jasa.di.Pemerintahan;Pengusaha Kecil dan Menengah Bisa Ikut Jadi Penyedia Barang/Jasa di Pemerintahan Dalam pelaksanaan pengadaan barang dan jasa pemerintahan harus memenuhi tujuh prinsip, yaitu efisien, efektif, transparan, terbuka, bersaing, adil/tidak diskriminatif, dan akuntabel. Untuk memenuhi prinsip tersebut, pemerintah memanfaatkan teknologi informasi dan komunikasi. Hal tersebut dilakukan untuk meningkatkan transparansi dan akuntabilitas, meningkatkan akses pasar dan persaingan usaha yang sehat, memperbaiki tingkat efisiensi proses pengadaan, mendukung proses monitoring dan audit, dan memenuhi kebutuhan akses informasi yang real time. Seperti yang sudah diketahui bersama bahwa setiap tahunnya, anggaran pengadaan barang dan jasa untuk pemerintahan sudah diatur dalam APBN. Berdasarkan data APBN 2015, anggaran belanja pengadaan Kementerian dan Lembaga sebesar Rp 529,4 triliun dan anggaran belanja pengadaan daerah sebesar Rp 454 triliun. Dari total dana yang ada, sekitar 55,82 persen diperuntukkan bagi belanja barang/jasa pemerintah. Dengan dana sebesar itu, kesempatan para pengusaha mencicipi APBN tentu besar. Untuk itu, sejak tahun 2008, Layanan Pengadaan Secara Elektronik (LPSE) dibentuk oleh pemerintah pusat dan daerah sebagai garda terdepan dalam mengawal dan memfasilitasi proses sistem pengadaan yang kredibel. Sampai saat ini sudah terbntuk sebanyak 636 LPSE yang tersebar dari Sabang hingga Merauke. Sebanyak 404 ribu pelaku usaha terlibat aktif dalam 543 ribu paket yang sudah dilelangkan. Walaupun dengan jumlah yang besar, ternyata masih banyak pengusaha yang masih terpinggirkan, sulit berkembang, dan ketinggalan informasi berkaitan dengan teknologi informasi. Hal ini terjadi karena ketidaktahuan tentang cara mengembangkan usaha mereka, terutama dalam pengadaan barang/jasa pemerintah. Saat ini, teknologi Informasi merupakan alat terbaik yang digunakan oleh pemerintah dalam pengadaan barang jasa. Dengan beberapa aplikasi yang sangat user friendly, penyedia dapat ikut dalam pengadaan barang jasa pemerintah. Cukup dengan mendaftar di dalam sistem, sering membuka inbox di sistem, penyedia dapat diundang otomatis oleh sistem yang digunakan entitas pengadaan untuk ikut berpartisipasi di dalam sistem pengadaan barang jasa pemerintah. Seperti dengan menggunakan Informasi Kinerja Penyedia (SIKaP) atau vendor mangement system. SIKaP merupakan aplikasi yang memuat data atau informasi kinerja penyedia barang/jasa di pemerintah. Informasi tersebut meliputi data mengenai identitas, kualifikasi, dan riwayat kinerja penyedia. Informasi ini merupakan serangkain data yang dijadikan sebagai data base untuk mengetahui segala hal yang berkaitan dengan kinerja penyedia barang jasa pemerintah. Fungsi SIKaP untuk mendapatkan penyedia yang benar kualified berdasarkan jenis atau kompetensi usaha yang dimilikinya, memudahkan segala proses penghitungan jumlah penyedia, memudahkan proses pengolahan data penyedia, dan dapat memusatkan data penyedia di seluruh Indonesia. SIKap memungkinkan pemerintah mempunyai daftar penyedia yang sudah sangat jelas identitas pokok, Surat  Ijin Usaha, informasi tentang pajak, akta pendirian, pemilik, tenaga ahli yang dimiliki, status peralatan, dan pengalaman. Penyedia juga mempunyai preferensi, apakah penyedia ingin mendapatkan pekerjaan di seluruh wilayah Indonesia, atau penyedia hanya ingin mendapatkan pekerjaan di wilayah tertentu saja. Penyedia juga diberikan kebebasan untuk ikut pengadaan barang/jasa pemerintah dalam batasan rupiah tertentu sesuai Harga Perkiraan Sendiri (HPS), bahkan penyedia dapat menentukan sendiri jenis pengadaan yang memang menjadi pilihan bisnis utamanya. Dengan mengisi SIKaP, penyedia berhak masuk dalam kriteria pilihan sesuai dengan kemampuannya masing-masing. Berikut alur proses pengisian LKPP :- Kelebihan dari aplikasi ini ialah setiap penyedia sangat mungkin ikut dan diundang oleh pemerintah dalam pelaksanaan percepatan pengadaan. Aplikasi yang dikenal saat ini adalah aplikasi elektronik tender cepat. Dengan memanfaatkan Informasi Kinerja Penyedia Barang/Jasa pemerintah dapat mencari penyedia terbaik di SIKaP, proses prakualifikasi dikurangi dan mempercepat proses lelang, dengan ketentuan paling cepat tiga hari. Aplikasi e-Tender Cepat dan Aplikasi SIkaP saling bekerja sama, sehingga memungkin penyedia cukup membuka inbox pada dashboard masing-masing, dan undangan untuk ikut menawar harga di pengadaan barang/jasa pemerintah berduyun-duyun datang di depan mata. Selama ini banyak pengusaha merasa peluang usaha di pengadaan barang jasa pemerintah masih sangat kecil, hal tersebut karena ketidakpahaman atas prosedur yang harus diikuti. Berikut bagan alur sederhana yang dilakukan oleh pengusaha baik pengusaha baru, maupun pengusaha yang sudah biasa ikut di pemerintah :- Dengan adanya SIKaP diharapkan pengusaha nasional, terutana pengusaha kecil dan menengah dapat menyadari bahwa pengadaan barang/jasa pemerintah adalah ladang yang menjanjikan dalam berusaha sekaligus membangun kesejahteraan masyarakat. Sebuah amanat partisipatif untuk memanggil anak bangsa dalam berusaha yang harus diikuti dengan ketelatenan, kesabaran, kegigihan, dan integritas untuk Indonesia yang lebih baik. (Adv) 
https://biz./read/2016/11/08/080000028/mengoptimalkan.manajemen.modal.kerja;Mengoptimalkan Manajemen Modal Kerja Bisnis saat ini menghadapi pasar yang kian kompetitif. Persoalan memaksimalkan arus kas, mengelola modal kerja, dan mendukung kebutuhan pembiayaan pemasok demi pengadaan barang yang stabil menjadi hal esensial yang perlu dicermati. Tujuannya, meningkatkan profitabilitas dan nilai perusahaan di mata pemegang saham. Salah satu solusi untuk mengoptimalkan manajemen modal kerja adalah memanfaatkan pembiayaan supply chain finance. Dibangun atas dasar hubungan perdagangan yang bonafide antara pembeli dan pemasok, pembiayaan alternatif ini dapat memberikan solusi struktur pembiayaan yang berbeda dari pinjaman jangka pendek biasa terutama dalam hal persyaratan penyediaan fasilitas oleh bank dan pencatatan akuntansi. Membantu mengoptimalkan arus kas dan modal kerja, supply chain finance memungkinkan pembeli untuk memperpanjang tenor pembayaran kepada pemasok (vendor) dengan memberikan vendor pilihan untuk dibayar lebih awal. Skema ini akan menguntungkan kedua belah pihak. Pertama, vendor dapat memiliki akses ke modal kerja dengan biaya yang lebih rendah. Kedua, pembeli dapat memanfaatkan situasi ini untuk menegosiasikan tenor pembayaran yang lebih panjang dari vendor sehingga dapat mempertahankan posisi kas selama mungkin atau menggunakannya untuk tujuan lain. Pembiayaan Vendor Bank of Tokyo-Mitsubishi UFJ (BTMU) menjadi solusi efektif untuk pengelolaan modal kerja bisnis nasabah dalam posisi sebagai pembeli. Tidak hanya membantu vendor mendapatkan pembayaran lebih cepat dari waktu yang telah ditentukan dalam perjanjian jual-beli, Pembiayaan Vendor BTMU ini juga dapat memberikan fleksibilitas terhadap nasabah yang ingin memperpanjang waktu pembayaran tagihan tanpa mengganggu jangka waktu piutang vendor. Pembiayaan Vendor BTMU mencakup tiga jenis skema yang dapat dilakukan melalui media elektronik dan non-elektronik, yaitu skema pembelian piutang (account receivable-A/R) milik vendor, pembelian wesel (bill of exchange B/E) yang ditagihkan vendor terhadap nasabah dan pembelian janji bayar (promisory notes-P/N) yang dikeluarkan nasabah kepada vendor. Pembelian ini dilakukan dengan mendiskonto jumlah tagihan terhadap nasabah dengan tanpa hak regres terhadap vendor. BTMU adalah bagian dari Mitsubishi UFJ Financial Group, Inc (MUFG), grup lembaga keuangan dunia terkemuka dengan jaringan internasional yang menjangkau lebih dari 50 negara. Di Asia, BTMU hadir di 18 negara termasuk Indonesia. Silakan menghubungi 021-30048208 (Transaction Banking Promotion Dept.) atau 021-5706185 (hunting) untuk informasi lebih lanjut mengenai Pembiayaan Vendor BTMU. (Adv) 
https://biz./read/2017/04/18/104428128/ilmu.perbendaharaan.tak.hanya.dibutuhkan.oleh.bank.tetapi.juga.para.pelaku.bisnis;Ilmu Perbendaharaan Tak Hanya Dibutuhkan oleh Bank, tetapi Juga Para Pelaku Bisnis Ilmu perbendaharaan atau treasury sangat identik dengan dunia perbankan. Ilmu di bidang keuangan ini ternyata harus dipelajari dari orang-orang yang memang langsung berkecimpung di bidang tersebut. Dengan memahami ilmu perbendaharaan, seorang pengusaha bisa mendistribusikan dana yang ia miliki untuk bisnisnya dengan tepat. Bila tidak, katanya, bisnis akan mengalami kesulitan ke depannya. Bagi bank, perbendaharaan pun memiliki peran yang sangat penting. “Di bank sendiri perbendaharaan berfungsi layaknya jantung. Ilmu perbendaharaan akan mengatur fungsi keluar masuk dana agar seimbang,” ujar Presiden Direktur PT Bank Central Asia Tbk (BCA) Jahja Setiaatmadja. Berdasarkan fungsi yang penting tersebut, Jahja menilai bahwa ilmu ini perlu dipelajari oleh pelaku bisnis atau orang pada umumnya. Oleh sebab itu, untuk membuka akses yang lebih luas untuk pembelajaran ilmu perbendaharaan, BCA bekerja sama ACI The Financial Markets Association of Indonesia (ACI FMA Indonesia) untuk pengadaan dan pembuatan modul E-Learning Produk Treasury. Dalam pembelajaran secara elektronik tersebut, terdapat modul untuk Foreign Exchange, Money Market, Fixed Income, Derivative Product, Regulasi dan Code of Conduct. Tujuan pengadaan modul-modul tersebut adalah menciptakan praktisi yang lebih profesional di sektor pasar keuangan. “Melalui e-learning ini, kami ingin memberi pengetahuan yang merata pada masyarakat. Apalagi, penggunaan ponsel pintar semakin marak, kami pun menggunakan gawai  yang sudah ada ini untuk menjadi alat pembelajaraan,” katanya. Presiden ACI FMA Indonesia Branko Windoe mengaku, semua materi dalam modul berasal dari BCA. “BCA yang menyediakan modul kemudian sedikit kami modifikasi tampilannya agar menarik,” ujarnya. Senada dengan Jahja, Branko juga mengatakan bahwa e-learning ini menjadi salah satu upaya untuk membuka akses pembelajaraan ilmu perbendahaan lebih luas lagi untuk masyarakat. “Akses ke modul ini nantinya akan berbayar bagi pengguna umum dengan harga sangat terjangkau,” kata Branko. Sedangkan untuk anggota ACI FMA Indonesia yang saat ini sudah mencapai lebih dari 60 bank adalah gratis. “Kalaupun bayar, nanti dengan biaya paling rendah,” katanya. Branko mengatakan, modul yang ada juga akan diperbarui tiap tahun seiring munculnya produk baru. (Adv) 
